<?xml version="1.0" encoding="UTF-8" ?>
<!DOCTYPE game SYSTEM "game_grammar.dtd">

<game>

    <players>
        <player></player>
        <player></player>
        <player></player>
    </players>

    <turn>
        <state>CHOOSE_WORKER</state>
        <player></player>
    </turn>

    <board>
        <cell>
            <x>0</x>
            <y>0</y>
            <level>GROUND</level>
            <worker>
                <player></player>
            </worker>
        </cell>
        <cell>
            <x>0</x>
            <y>1</y>
            <level>GROUND</level>
            <worker>
                <player></player>
            </worker>
        </cell>
        <cell>
            <x>0</x>
            <y>2</y>
            <level>GROUND</level>
            <worker>
                <player></player>
            </worker>
        </cell>
        <cell>
            <x>0</x>
            <y>3</y>
            <level>GROUND</level>
        </cell>
        <cell>
            <x>0</x>
            <y>4</y>
            <level>GROUND</level>
        </cell>
        <cell>
            <x>1</x>
            <y>0</y>
            <level>GROUND</level>
        </cell>
        <cell>
            <x>1</x>
            <y>1</y>
            <level>GROUND</level>
        </cell>
        <cell>
            <x>1</x>
            <y>2</y>
            <level>GROUND</level>
        </cell>
        <cell>
            <x>1</x>
            <y>3</y>
            <level>GROUND</level>
        </cell>
        <cell>
            <x>1</x>
            <y>4</y>
            <level>GROUND</level>
        </cell>
        <cell>
            <x>2</x>
            <y>0</y>
            <level>GROUND</level>
        </cell>
        <cell>
            <x>2</x>
            <y>1</y>
            <level>GROUND</level>
        </cell>
        <cell>
            <x>2</x>
            <y>2</y>
            <level>GROUND</level>
        </cell>
        <cell>
            <x>2</x>
            <y>3</y>
            <level>GROUND</level>
        </cell>
        <cell>
            <x>2</x>
            <y>4</y>
            <level>GROUND</level>
        </cell>
        <cell>
            <x>3</x>
            <y>0</y>
            <level>GROUND</level>
        </cell>
        <cell>
            <x>3</x>
            <y>1</y>
            <level>GROUND</level>
        </cell>
        <cell>
            <x>3</x>
            <y>2</y>
            <level>GROUND</level>
        </cell>
        <cell>
            <x>3</x>
            <y>3</y>
            <level>GROUND</level>
        </cell>
        <cell>
            <x>3</x>
            <y>4</y>
            <level>GROUND</level>
        </cell>
        <cell>
            <x>4</x>
            <y>0</y>
            <level>GROUND</level>
        </cell>
        <cell>
            <x>4</x>
            <y>1</y>
            <level>GROUND</level>
        </cell>
        <cell>
            <x>4</x>
            <y>2</y>
            <level>GROUND</level>
        </cell>
        <cell>
            <x>4</x>
            <y>3</y>
            <level>GROUND</level>
        </cell>
        <cell>
            <x>4</x>
            <y>4</y>
            <level>GROUND</level>
        </cell>
    </board>

</game>